id	name
3314	ACM Transactions in Embedded Computing Systems
3315	International Journal of Computer Science and Information Technology
3316	Learned Publishing
3322	semantics, knowledge and grid
3326	International Journal of Grid and Utility Computing
3327	International Journal of Radio Frequency Identification Technology and Applications
3335	International Journal of Humanoid Robotics
3336	high performance switching and routing
3343	International Journal of Computer Aided Engineering and Technology
3358	International Journal of Business Information Systems
3364	International Journal of Wireless and Mobile Computing
3365	International Journal of Shape Modeling
3375	International Journal of Bio-inspired Computation
3379	International Journal of Applied Decision Sciences
3380	International Journal of Intelligent Engineering Informatics
3386	intelligent data acquisition and advanced computing systems: technology and applications
3388	Eurasip Journal on Information Security
3390	frontier of computer science and technology
3398	International Journal of Mobile Communications
3400	International Journal of Computing Science and Mathematics
3406	International Journal of Ad Hoc and Ubiquitous Computing
3407	Journal of Vlsi Signal Processing Systems for Signal Image and Video Technology
3414	empirical software engineering and measurement
3422	International Journal of Electronic Security and Digital Forensics
3429	Ima Journal of Mathematical Control and Information
3431	Journal of Mathematical Cryptology
3434	International Journal of Semantic Computing
3440	International Journal of Computational Intelligence Studies
3444	International Journal of Mobile Learning and Organisation
3454	International Journal of Communication Networks and Distributed Systems
3456	International Journal of Advanced Intelligence Paradigms
3460	Advances in Numerical Analysis
3472	International Journal of Internet Protocol Technology
3481	International Journal of Services Technology and Management
3482	International Journal of Advanced Operations Management
3485	Microprocessing and Microprogramming
3487	symposium on principles of programming languages
3494	AIP Advances
3496	International Journal of Security and Networks
3500	International Journal of Learning Technology
3501	Database
3503	The International Journal of Multimedia & Its Applications
3511	international conference on computational advances in bio and medical sciences
3516	International Journal of Data Analysis Techniques and Strategies
3522	International Journal of Computational Intelligence and Applications
3524	Vitae-revista De La Facultad De Quimica Farmaceutica
3528	International Journal of Digital Library Systems
3530	ACM Transactions on Reconfigurable Technology and Systems
3531	requirements engineering
3532	International Journal of Critical Computer-based Systems
3543	nature and biologically inspired computing
3549	acs/ieee international conference on computer systems and applications
3552	International Journal of Electronic Business
3560	international conference on networking sensing and control
3562	International Journal of Business Performance and Supply Chain Modelling
3565	european conference on circuit theory and design
3567	cyber-enabled distributed computing and knowledge discovery
3570	conference on computer as a tool
3571	IEEE Transactions on Applications and Industry
3572	self-adaptive and self-organizing systems
3583	IEEE Transactions on Education
3586	ACM Sigada Ada Letters
3610	Eurasip Journal on Embedded Systems
3615	IEEE Parallel & Distributed Technology: Systems & Applications
3618	Concurrent Engineering
3634	International Journal of Software Engineering & Applications
3639	International Journal of Computational Vision and Robotics
3648	multimedia interaction design and innovation
3652	interactive 3d graphics and games
3653	ACM Sigsam Bulletin
3654	IEEE Transactions on Electronic Computers
3656	international conference on systems and networks communications
3657	virtual reality continuum and its applications in industry
3659	electronic and mechanical engineering and information technology
3660	international conference on e-business engineering
3661	international conference on education technology and computer
3662	brazilian symposium on multimedia and the web
3663	Frontiers in Education
3665	workshop on privacy in the electronic society
3666	document engineering
3667	soft computing and pattern recognition
3670	international conference on cyber-physical systems
3671	non-photorealistic animation and rendering
3673	information and communication technologies and development
3674	Mobile Computing and Communications Review
3675	international conference on ubiquitous information management and communication
3677	euro american conference on telematics and information systems
3678	nordic conference on human-computer interaction
3679	advanced robotics and its social impacts
3681	performance evaluation of wireless ad hoc, sensor, and ubiquitous networks
3682	spoken language technology workshop
3683	wireless, mobile and ubiquitous technologies in education
3684	Journal of Numerical Mathematics
3686	advanced industrial conference on telecommunications
3687	virtual reality software and technology
3688	International Journal of Intelligent Systems Technologies and Applications
3689	Infor
3690	mobility management and wireless access
3691	self adaptive and self organizing systems
3692	mobile and ubiquitous multimedia
3694	modeling analysis and simulation of wireless and mobile systems
3695	acm conference on systems programming languages and applications software for humanity
3696	next generation mobile applications, services and technologies
3699	mobile ad hoc networking and computing
3700	balkan conference in informatics
3702	wireless network security
3703	international conference on asian language processing
3704	International Journal of Metadata, Semantics and Ontologies
3705	symposium on integrated circuits and systems design
3706	applied perception in graphics and visualization
3707	architectures for networking and communications systems
3709	international conference on supporting group work
3710	compilers, architecture, and synthesis for embedded systems
3711	acm ieee international conference on mobile computing and networking
3715	Communication Research
3719	conference on computer graphics and interactive techniques in australasia and southeast asia
3720	International Journal of Medical Engineering and Informatics
3722	international conference on electrical engineering and informatics
3725	pervasive technologies related to assistive environments
3726	Intelligent Information Management
3727	conference on computers and accessibility
3728	management of emergent digital ecosystems
3730	workshop on positioning navigation and communication
3731	Int'l J. of Communications, Network and System Sciences
3732	nano micro engineered and molecular systems
3734	security of information and networks
3735	information interaction in context
3738	international conference on mobile technology applications and systems
3740	Traitement Du Signal
3742	digital interactive media in entertainment and arts
3743	dynamic languages symposium
3744	International Journal of Functional Informatics and Personalised Medicine
3748	vehicular networking conference
3749	ACM Transactions on Computing Education \/ ACM Journal of Educational Resources in Computing
3750	IEEE Transactions on Systems Science and Cybernetics
3751	european conference on computer systems
3752	International Journal of Digital Multimedia Broadcasting
3753	International Journal of Central Banking
3754	international computing education research workshop
3755	network and system support for games
3756	distributed event-based systems
3757	Siam Journal on Scientific and Statistical Computing
3758	spring conference on computer graphics
3759	international symposium on computational intelligence and design
3761	International Journal of Humanities and Arts Computing
3762	International Journal of High Speed Computing
3763	automation of software test
3764	pacific-asia conference on circuits, communications and systems
3765	Journal of Software Engineering and Applications
3766	virtual execution environments
3768	eclipse technology exchange
3769	Journal of Aerospace Computing Information and Communication
3774	International Journal of Open Source Software and Processes
3775	cognitive radio and advanced spectrum management
3778	international conference on automation and logistics
3780	international conference on performance engineering
3781	Literary and Linguistic Computing
3782	Computer Languages
3783	Journal of Information Security
3785	International Journal of Computational Engineering Science
3790	computer human interaction for management of information technology
3797	international conference on ehealth, telemedicine, and social medicine
3801	symposium on application specific processors
3802	International Journal of Applied Logistics
3803	wireless and optical communications networks
3804	International Journal of Satellite Communications
3805	visualizing software for understanding and analysis
3806	digital game and intelligent toy enhanced learning
3808	International Journal of Artificial Intelligence & Applications
3809	workflows in support of large scale science
3820	Scientific Journal of Riga Technical University. Computer Sciences
3826	designing for user experiences
3837	Revue Dintelligence Artificielle
3842	International Journal of Information Acquisition
3843	conference on high performance computing supercomputing
3848	ACM Standardview
3851	International Journal of Business Process Integration and Management
3861	IEEE Transactions on Computational Social Systems
3862	History and Computing
3863	Impact of Computing in Science and Engineering
3866	data storage and data engineering
3871	IEEE Transactions on Information Technology in Biomedicine
3879	Biophysical Journal
3881	ReCALL
3884	european solid state circuits conference
3887	international conference on the digital society
3889	semantics knowledge and grid
3894	Circuits and Systems
3898	International Journal of Ad Hoc, Sensor & Ubiquitous Computing
3902	asia-pacific conference on wearable computing systems
3915	petascale data storage workshop
3916	international solid state circuits conference
3919	Argument & Computation
3921	Synthesis Lectures on Biomedical Engineering
3923	Journal of Geographic Information System
3927	intelligent information technology application
3934	ACM Sigsim Simulation Digest
3938	International Journal of Next-generation Networks
3939	principles, systems and applications of ip telecommunications
3941	international conference on e business engineering
3945	International Journal of Intelligent Defence Support Systems
3957	Journal of Shanghai Jiaotong University (science)
3970	international conference on mobile systems applications and services
3986	pacific-asia workshop on computational intelligence and industrial application
4019	data mining and optimization
4038	Physics in Medicine and Biology
4040	Clinical Rehabilitation
4041	Stochastics An International Journal of Probability and Stochastic Processes
4044	Journal of Personality and Social Psychology
4046	Statistics & Probability Letters
4047	International Journal of Reliability, Quality and Safety Engineering
4050	Urological Research
4108	Cheminform
4117	intelligent data acquisition and advanced computing systems technology and applications
4119	Synthesis Lectures on Communications
4176	Medical Physics
4198	Revue D'anthropologie Des Connaissances
4218	Journal of Algorithms & Computational Technology
4227	Iete Technical Review
4249	International Journal of Remote Sensing
4256	The Bottom Line: Managing Library Finances
4271	Microelectronics International
4273	American Journal of Botany
4295	Theoretical Chemistry Accounts
4317	Journal of Cardiovascular Magnetic Resonance
4481	Physics Reports
4558	arXiv: Cosmology and Nongalactic Astrophysics
4639	Physical Chemistry Chemical Physics
4670	Pump Industry Analyst
4785	Parasitology International
4818	signal image technology and internet based systems
4830	Data Science and Engineering
